{
  "id": "godot4-environment",
  "engine": "Godot 4",
  "assetProfile": "environment",
  "sceneImport": {
    "useNameSuffixes": true,
    "useNodeTypeSuffixes": true,
    "generateTangentsIfMissing": true,
    "preferStaticScene": true,
    "navigationCandidate": true
  },
  "animation": {
    "import": false,
    "fps": 30,
    "trimming": true,
    "removeImmutableTracks": true
  },
  "textures": {
    "preferEmbeddedOrProjectLocal": true,
    "remoteUrisAllowed": false
  }
}
