{
  "id": "godot4-character",
  "engine": "Godot 4",
  "assetProfile": "character",
  "sceneImport": {
    "useNameSuffixes": true,
    "useNodeTypeSuffixes": true,
    "generateTangentsIfMissing": true,
    "preferStaticScene": false
  },
  "animation": {
    "import": true,
    "fps": 60,
    "trimming": false,
    "removeImmutableTracks": false
  },
  "textures": {
    "preferEmbeddedOrProjectLocal": true,
    "remoteUrisAllowed": false
  }
}
